"caption","commentsCount","likesCount","type","videoViewCount","timestamp","images/0","images/1","images/2","images/3","images/4","images/5","images/6","images/7"
"“Anybody can publish at Youth Ki Awaaz”

Back in 2017, just before the @obamafoundation’s Town Hall in New Delhi, our founder @anshultewari shared the story of why he started Youth Ki Awaaz — a space where anyone, regardless of their background, could write, be heard, and challenge the silence that surrounds critical issues in India.

Since then, we’ve grown into a powerful, people-led community of writers, readers, creators, and changemakers, driven by truth, care, and the belief that everyday stories can spark extraordinary change. On YKA, you don’t need permission to speak up. You just need the will to start.

Speak up. Share your truth.

Publish your story at www.youthkiawaaz.com

[youth voices, citizen journalism, storytelling platform, write your story, youth empowerment, anshul tewari, obama foundation, digital expression, speak your truth, inclusive media, people's platform, social justice, community stories, unheard voices, changemakers, truth matters, writing for change, public narrative, opinion writing, platform for youth, social impact, journalism for all, open platform, youth media, write to be heard, community-led media, publishing freedom, amplify voices, real stories, Indian youth, unheard stories, courage to speak, write online, speak up India, everyday activism, new media India, people power, democratic expression, grassroots journalism, story revolution]

#YouthKiAwaaz #ObamaFoundation #WriteYourStory #CitizenJournalism #YouthVoices #IndianYouth #DigitalActivism #AmplifyVoices #PublishNow #StorytellingForChange #TruthMatters #OpenPlatform #PowerOfWords #Writerscommunity #ChangeMakers #CommunityVoices #EverydayStories #YouthEmpowerment #UnheardVoices #IndiaSpeaks #PeopleLedMedia #storytellers #NewMediaIndia #NoPermissionNeeded #reelitfeelit #ReelWithPurpose #ReelOfTheDay #fyp #explorepage #foryourpurpose","9","390","Video","5678","2025-08-08T15:32:53.000Z",,,,,,,,
"""So maybe the question isn’t “why do people like K-pop?” Maybe it’s “why are we so quick to mock people, especially young women and boys, for loving something that doesn’t fit our idea of cool or masculine?“

Why is a stadium full of men screaming for Virat Kohli seen as passion, but a stadium full of women screaming for BTS seen as obsession?

Why is it embarrassing for a boy to admit he likes Jin, but completely fine for another to cry over Dhoni’s retirement? The answer always circles back to the same thing: toxic masculinity,"" Krish writes on Youth Ki Awaaz.

[BTS, toxic masculinity, BTS Army, gender equality, BTS fans, breaking stereotypes, music connects, connection over competition, respect fandoms, love without shame, let people love, BTS culture, Kpop and identity, inclusivity, compassion, celebrate diversity, safe spaces, unlearn patriarchy, stop mocking, breaking gender norms, empathy matters, positive masculinity, cultural freedom, dismantle patriarchy, music is for all, acceptance, allyship, breaking toxic masculinity, healthy masculinity, empathy in action, global fandom, celebrate fandom, love beyond borders, cultural acceptance, BTS inspiration, real masculinity, music without borders, support BTS fans, fandom shaming, equality for all, respect choices]

#BTS #BTSARMY #ToxicMasculinity #ConnectionOverCompetition #LetPeopleLove #MusicWithoutBorders #LoveWithoutShame #BreakTheStereotype #HealthyMasculinity #RespectFandoms #UnlearnPatriarchy #StopMocking #CelebrateDiversity #PositiveMasculinity #GenderEquality #SafeSpacesMatter #BTSInspires #MusicIsForAll #CompassionFirst #ConnectionNotCompetition #CulturalFreedom #EmpathyOverEgo #SupportBTSFans #BreakGenderRoles #BTSLove #fyp #explorepage #foryourpage","386","29621","Sidecar",,"2025-08-27T12:30:27.000Z","https://scontent-atl3-2.cdninstagram.com/v/t51.2885-15/539385455_18523650439043990_6784804044565421949_n.webp?stp=dst-jpg_e35_p1080x1080_sh0.08_tt6&_nc_ht=scontent-atl3-2.cdninstagram.com&_nc_cat=102&_nc_oc=Q6cZ2QEav_WZ142PxYJIeQFWcK52jo2mvo5eeo_oCk8uj1iaAP1NW_6J45fnnMzH0PELKdU&_nc_ohc=OULGuAjJLvsQ7kNvwGmzfHM&_nc_gid=CqrdpTgPm_BQ3LxfU-V1dQ&edm=APs17CUBAAAA&ccb=7-5&oh=00_Aff9okSafBncCCl7zIT5BJHmYJSlD_3FGFm52Mqwi6DoUQ&oe=68EDD164&_nc_sid=10d13b","https://scontent-atl3-2.cdninstagram.com/v/t51.2885-15/539521908_18523650448043990_1562011240963118102_n.webp?stp=dst-jpg_e35_p1080x1080_sh0.08_tt6&_nc_ht=scontent-atl3-2.cdninstagram.com&_nc_cat=102&_nc_oc=Q6cZ2QEav_WZ142PxYJIeQFWcK52jo2mvo5eeo_oCk8uj1iaAP1NW_6J45fnnMzH0PELKdU&_nc_ohc=EdH1daRRXxEQ7kNvwHguhDI&_nc_gid=CqrdpTgPm_BQ3LxfU-V1dQ&edm=APs17CUBAAAA&ccb=7-5&oh=00_AfckqtIGE0TyMIvpTHoscRdUFv6QhZBZExQsPlW2ceieUA&oe=68EDAE3B&_nc_sid=10d13b","https://scontent-atl3-2.cdninstagram.com/v/t51.2885-15/539535310_18523650457043990_782574260632989268_n.webp?stp=dst-jpg_e35_p1080x1080_sh0.08_tt6&_nc_ht=scontent-atl3-2.cdninstagram.com&_nc_cat=102&_nc_oc=Q6cZ2QEav_WZ142PxYJIeQFWcK52jo2mvo5eeo_oCk8uj1iaAP1NW_6J45fnnMzH0PELKdU&_nc_ohc=PPwVEvMEzUIQ7kNvwFd09eg&_nc_gid=CqrdpTgPm_BQ3LxfU-V1dQ&edm=APs17CUBAAAA&ccb=7-5&oh=00_AfcKDbvvJ_14uR2R39bycq0w32TghccRYh1CYgrImzbQQw&oe=68EDCDB7&_nc_sid=10d13b","https://scontent-atl3-2.cdninstagram.com/v/t51.2885-15/540012368_18523650466043990_6197414226839435504_n.webp?stp=dst-jpg_e35_p1080x1080_sh0.08_tt6&_nc_ht=scontent-atl3-2.cdninstagram.com&_nc_cat=102&_nc_oc=Q6cZ2QEav_WZ142PxYJIeQFWcK52jo2mvo5eeo_oCk8uj1iaAP1NW_6J45fnnMzH0PELKdU&_nc_ohc=zSk7DZNPncsQ7kNvwEZMmWC&_nc_gid=CqrdpTgPm_BQ3LxfU-V1dQ&edm=APs17CUBAAAA&ccb=7-5&oh=00_AffbwzTILKwoGTWF8DWWUwhoPZswTqklQHPaMqGN91R36w&oe=68EDAC05&_nc_sid=10d13b","https://scontent-atl3-2.cdninstagram.com/v/t51.2885-15/539394018_18523650475043990_4227511331135897692_n.webp?stp=dst-jpg_e35_p1080x1080_sh0.08_tt6&_nc_ht=scontent-atl3-2.cdninstagram.com&_nc_cat=102&_nc_oc=Q6cZ2QEav_WZ142PxYJIeQFWcK52jo2mvo5eeo_oCk8uj1iaAP1NW_6J45fnnMzH0PELKdU&_nc_ohc=wadUfziyFeAQ7kNvwEBFjMN&_nc_gid=CqrdpTgPm_BQ3LxfU-V1dQ&edm=APs17CUBAAAA&ccb=7-5&oh=00_AfdzUyzKtiG_awkmG6Gc5PvPORs-Y9JWxs2PpxkDo4lrVA&oe=68EDB88C&_nc_sid=10d13b","https://scontent-atl3-2.cdninstagram.com/v/t51.2885-15/540694968_18523650484043990_8654765223274580890_n.webp?stp=dst-jpg_e35_p1080x1080_sh0.08_tt6&_nc_ht=scontent-atl3-2.cdninstagram.com&_nc_cat=102&_nc_oc=Q6cZ2QEav_WZ142PxYJIeQFWcK52jo2mvo5eeo_oCk8uj1iaAP1NW_6J45fnnMzH0PELKdU&_nc_ohc=5qVmmVg6xwoQ7kNvwFnbLhV&_nc_gid=CqrdpTgPm_BQ3LxfU-V1dQ&edm=APs17CUBAAAA&ccb=7-5&oh=00_AfdRcWPwLyxcgAz2BvJbXpVcbJz3b6FeMijObucwCPFOhA&oe=68EDB1F0&_nc_sid=10d13b",,
"""Youth unemployment in India is not just an economic problem — it is a social crisis. And in this crisis, false promises can be as damaging as job losses. We need structural reforms for genuine employment, stronger rules against digital frauds, and most importantly, a culture of awareness where young people support and protect each other. Because the truth is simple: India’s youth don’t need flashy “gurus.” We need real jobs, fair opportunities, and leaders who understand our struggles. Until then, we must be careful not to let fake hopes steal our time, money, and dignity,"" Surjit writes on Youth Ki Awaaz.

[youth unemployment, job crisis, fake gurus, employment scams, skill development, digital frauds, online training scams, LinkedIn coaches, YouTube trainers, job market, layoffs in India, TCS layoffs, employability crisis, PLFS data, work culture, jobless graduates, fake promises, digital influencers, scam awareness, social media fraud, startup layoffs, skill gap, Indian economy, fake job ads, online workshops, scam prevention, youth awareness, job readiness, work from home scams, unemployment rate, career struggles, digital literacy, online jobs, job insecurity, fake job offers, gig economy, employability, mentorship, education to employment gap, job seekers India]

#YouthUnemployment #JobCrisisIndia #FakeGurus #EmploymentScams #SkillFrauds #DigitalScams #RealJobsNeeded #YouthKiAwaaz #IndiaJobsCrisis #LayoffCulture #CareerAwareness #ScamAlertIndia #OnlineFraudAwareness #JobHuntIndia #StopFakeGurus #WorkRealityCheck #IndianYouthVoices #SkillIndiaReality #DigitalIndiaDebate #UnemploymentReality #JobSeekersIndia #YouthDeserveBetter #CareerCrisis #FakePromiseCulture #fyp #explorepage #ｆｏｒｙｏｕｒｐａｇｅ","4","324","Sidecar",,"2025-10-07T12:37:07.000Z","https://scontent-dfw5-2.cdninstagram.com/v/t51.2885-15/560100296_18531900586043990_6242743678738017081_n.webp?stp=dst-jpg_e35_p1080x1080_sh0.08_tt6&_nc_ht=scontent-dfw5-2.cdninstagram.com&_nc_cat=102&_nc_oc=Q6cZ2QFt4FohN4dPZacdwLRyXViG12WwJzeVK65j4v9rihkUQ8qWu4JyHnZM0d16-g--fGA&_nc_ohc=wrrCMZ8-YJ8Q7kNvwG40Fw0&_nc_gid=oc2jqv2qIphurfDX-Tkb3w&edm=APs17CUBAAAA&ccb=7-5&oh=00_AfddvPWzE7cjrnd43bHZRBx1qtbW3lQ0h5NUQdDSQsO2ww&oe=68EDBE85&_nc_sid=10d13b","https://scontent-dfw5-2.cdninstagram.com/v/t51.2885-15/560272655_18531900601043990_4855604136151128457_n.webp?stp=dst-jpg_e35_p1080x1080_sh0.08_tt6&_nc_ht=scontent-dfw5-2.cdninstagram.com&_nc_cat=102&_nc_oc=Q6cZ2QFt4FohN4dPZacdwLRyXViG12WwJzeVK65j4v9rihkUQ8qWu4JyHnZM0d16-g--fGA&_nc_ohc=oVOq2Yi0kNsQ7kNvwE-FF2D&_nc_gid=oc2jqv2qIphurfDX-Tkb3w&edm=APs17CUBAAAA&ccb=7-5&oh=00_Affvq11SRlGAnQ9_MpHcqtQ5VW-8aYNbbLSKrQb0IsffiA&oe=68EDD0B2&_nc_sid=10d13b","https://scontent-dfw5-2.cdninstagram.com/v/t51.2885-15/559954982_18531900604043990_6492522712464696175_n.webp?stp=dst-jpg_e35_p1080x1080_sh0.08_tt6&_nc_ht=scontent-dfw5-2.cdninstagram.com&_nc_cat=102&_nc_oc=Q6cZ2QFt4FohN4dPZacdwLRyXViG12WwJzeVK65j4v9rihkUQ8qWu4JyHnZM0d16-g--fGA&_nc_ohc=-8P45e56NrwQ7kNvwFnXd_W&_nc_gid=oc2jqv2qIphurfDX-Tkb3w&edm=APs17CUBAAAA&ccb=7-5&oh=00_Affdn5JmCccKlM143VxGxxEfam2DgfI35O5vbVDRq-Ctow&oe=68EDB1B9&_nc_sid=10d13b","https://scontent-dfw5-2.cdninstagram.com/v/t51.2885-15/561725376_18531900619043990_2292429918040856545_n.webp?stp=dst-jpg_e35_p1080x1080_sh0.08_tt6&_nc_ht=scontent-dfw5-2.cdninstagram.com&_nc_cat=102&_nc_oc=Q6cZ2QFt4FohN4dPZacdwLRyXViG12WwJzeVK65j4v9rihkUQ8qWu4JyHnZM0d16-g--fGA&_nc_ohc=dT6HQFK68IIQ7kNvwFlCCZJ&_nc_gid=oc2jqv2qIphurfDX-Tkb3w&edm=APs17CUBAAAA&ccb=7-5&oh=00_Afetrr6Prmt9HCGWNvotNh_XiNrWPLmRCLrkZQL9vrOPhw&oe=68EDB63D&_nc_sid=10d13b","https://scontent-dfw5-2.cdninstagram.com/v/t51.2885-15/559299948_18531900622043990_7840050406045776275_n.webp?stp=dst-jpg_e35_p1080x1080_sh0.08_tt6&_nc_ht=scontent-dfw5-2.cdninstagram.com&_nc_cat=102&_nc_oc=Q6cZ2QFt4FohN4dPZacdwLRyXViG12WwJzeVK65j4v9rihkUQ8qWu4JyHnZM0d16-g--fGA&_nc_ohc=1Sa1hTAn2_wQ7kNvwGHlhY9&_nc_gid=oc2jqv2qIphurfDX-Tkb3w&edm=APs17CUBAAAA&ccb=7-5&oh=00_AfdYoQ_rPtjP5XT6eoxnYz-x-UtKHzfB1QyP1bOjh1OZ7Q&oe=68EDABE4&_nc_sid=10d13b",,,
"""In my thirties, home has now become both what I carry and what I create - a tapestry of spaces, people, and selves, identities, solidarities stitched together across time. It's a feeling I get when I see all my things have a place to be, where all of me has a place to be. It's where I run to when nothing makes sense. Or maybe it's what I run away from, to make sense of who I am, Azra writes on Youth Ki Awaaz.

This story was selected as one of the top entries in our #RoomsofOurOwn contest in collaboration with HarperCollins India.

[Kashmiri women, home, belonging, nostalgia, refuge, negotiation, identity, diaspora, migration, independence, womanhood, feminism, Kashmiri Muslim, personal story, resilience, female voices, safe spaces, gender, empowerment, cultural identity, memory, selfhood, city life, hostel life, shared spaces, solidarity, women's experiences, growing up, moving away, adaptation, personal growth, autonomy, transition, heritage, diaspora community, women's stories, urban life, living away from home, privacy, chosen family, survival, home as sanctuary]

#KashmiriWomen #HomelsRefuge #Belonging #FeministStories #WomenVoices #KashmiriMuslim #PersonalStory #RoomsOfOurOwn #WomenEmpowerment #IdentityAndHome #SafeSpacesForWomen #Nostalgia #FemalePerspective #LivingAwayFromHome #WomenStoriesMatter #RefugeAndResilience #HomeAndIdentity #WomenGrowingUp #SharedSpaces #UrbanWomenLife #SolidarityAmongWomen #IndependenceAndIdentity #NegotiatingHome #WomenLifeJourney #ChosenFamily #fyp #explorepage #foryourpage #ɢᴏᴠɪʀᴀʟ","0","106","Sidecar",,"2025-10-05T06:13:31.000Z","https://scontent-ord5-2.cdninstagram.com/v/t51.2885-15/559141616_18531420451043990_6448937799220217769_n.webp?stp=dst-jpg_e35_p1080x1080_sh0.08_tt6&_nc_ht=scontent-ord5-2.cdninstagram.com&_nc_cat=102&_nc_oc=Q6cZ2QFxl8Y_JoZsdEoU6eN52zuk1VpZMwniCCdJFxpSNqq0-mQwMUrxRkAkQ5SG7i79yFW84ttMEfFWzZg48Z8ROY3k&_nc_ohc=KhGkOHT6j04Q7kNvwEQOmQz&_nc_gid=5MpxeJch1Pr0Y_kE4QnZaA&edm=APs17CUBAAAA&ccb=7-5&oh=00_Afe_dPV0A-aQumeiNgR19rNPL0J_12iAr38LNXw3iRf8cQ&oe=68EDCF74&_nc_sid=10d13b","https://scontent-ord5-2.cdninstagram.com/v/t51.2885-15/559906521_18531420460043990_2576848018348866186_n.webp?stp=dst-jpg_e35_p1080x1080_sh0.08_tt6&_nc_ht=scontent-ord5-2.cdninstagram.com&_nc_cat=102&_nc_oc=Q6cZ2QFxl8Y_JoZsdEoU6eN52zuk1VpZMwniCCdJFxpSNqq0-mQwMUrxRkAkQ5SG7i79yFW84ttMEfFWzZg48Z8ROY3k&_nc_ohc=7sk4JYZriWsQ7kNvwHvZxkL&_nc_gid=5MpxeJch1Pr0Y_kE4QnZaA&edm=APs17CUBAAAA&ccb=7-5&oh=00_AfcrdU81UCn0Pp_bjauxe95uNhrdC2fK8ZBAV4jVP7cb1Q&oe=68EDC193&_nc_sid=10d13b","https://scontent-ord5-2.cdninstagram.com/v/t51.2885-15/561534458_18531420469043990_5301542630345585984_n.webp?stp=dst-jpg_e35_p1080x1080_sh0.08_tt6&_nc_ht=scontent-ord5-2.cdninstagram.com&_nc_cat=102&_nc_oc=Q6cZ2QFxl8Y_JoZsdEoU6eN52zuk1VpZMwniCCdJFxpSNqq0-mQwMUrxRkAkQ5SG7i79yFW84ttMEfFWzZg48Z8ROY3k&_nc_ohc=aGSQuBjkZqgQ7kNvwHQ9gBC&_nc_gid=5MpxeJch1Pr0Y_kE4QnZaA&edm=APs17CUBAAAA&ccb=7-5&oh=00_Afe5vlfF4vf7q-SHmmz_zTS6OkmzwJ8RMGlgwNCL5jdh9Q&oe=68EDC7F0&_nc_sid=10d13b","https://scontent-ord5-2.cdninstagram.com/v/t51.2885-15/559251918_18531420478043990_6414764934381591982_n.webp?stp=dst-jpg_e35_p1080x1080_sh0.08_tt6&_nc_ht=scontent-ord5-2.cdninstagram.com&_nc_cat=102&_nc_oc=Q6cZ2QFxl8Y_JoZsdEoU6eN52zuk1VpZMwniCCdJFxpSNqq0-mQwMUrxRkAkQ5SG7i79yFW84ttMEfFWzZg48Z8ROY3k&_nc_ohc=j6kuFyX-wusQ7kNvwHFCRas&_nc_gid=5MpxeJch1Pr0Y_kE4QnZaA&edm=APs17CUBAAAA&ccb=7-5&oh=00_AfcD-5MpGlgh1qd1wmG0b6serOX_kGMHqi-uLuvECP7-ww&oe=68EDC62F&_nc_sid=10d13b","https://scontent-ord5-2.cdninstagram.com/v/t51.2885-15/558908700_18531420487043990_3548929161019182338_n.webp?stp=dst-jpg_e35_p1080x1080_sh0.08_tt6&_nc_ht=scontent-ord5-2.cdninstagram.com&_nc_cat=102&_nc_oc=Q6cZ2QFxl8Y_JoZsdEoU6eN52zuk1VpZMwniCCdJFxpSNqq0-mQwMUrxRkAkQ5SG7i79yFW84ttMEfFWzZg48Z8ROY3k&_nc_ohc=QjpY8xw9iJ0Q7kNvwEeDJ07&_nc_gid=5MpxeJch1Pr0Y_kE4QnZaA&edm=APs17CUBAAAA&ccb=7-5&oh=00_Afd2z1qLAJ8NTWWUreP_sEPRJasuSa3IlNUUejb9j0260Q&oe=68EDB158&_nc_sid=10d13b","https://scontent-ord5-2.cdninstagram.com/v/t51.2885-15/560463537_18531420496043990_5994063506208399727_n.webp?stp=dst-jpg_e35_p1080x1080_sh0.08_tt6&_nc_ht=scontent-ord5-2.cdninstagram.com&_nc_cat=102&_nc_oc=Q6cZ2QFxl8Y_JoZsdEoU6eN52zuk1VpZMwniCCdJFxpSNqq0-mQwMUrxRkAkQ5SG7i79yFW84ttMEfFWzZg48Z8ROY3k&_nc_ohc=oQPCXfkh3H8Q7kNvwF6H0Gh&_nc_gid=5MpxeJch1Pr0Y_kE4QnZaA&edm=APs17CUBAAAA&ccb=7-5&oh=00_AfcF0B3Gh3ecSbhg2aZ6PhNwQr-TpGaPLYHmx0upMUfBIA&oe=68EDCA8F&_nc_sid=10d13b",,
"Sometimes being yourself feels like a rebellion. @chapter2drip's recent ad, directed by @rhea_chakraborty , shows that love doesn’t need permission, and honesty shouldn’t be hidden. A simple conversation between two siblings - one sharing that they're dating a guy - becomes a quiet act of courage, reflecting the realities LGBTQIA+ community face every day.

The supportive reaction reminds us how powerful acceptance within families can be. It’s proof that safe spaces start at home, where love is celebrated and identities are respected without shame.

Because closets are meant for clothes not for who you love. Watch the ad, share it, and help create a world where every LGBTQIA+ individual feels free to be themselves, starting with the family that surrounds them.

[love is love, LGBTQIA, pride, inclusivity, acceptance, support, sibling love, coming out, fashion, streetwear, Chapter 2 Drip, best ad, courage, safe spaces, identity, freedom, family support, relationships, gay, bisexual, queer love, gender equality, empowerment, visibility, allyship, acceptance at home, clothing brand, rebellion, self-expression, equality, love wins]

#loveislove #LGBTQIA #Pride #Inclusivity #Acceptance #Support #SiblingLove #ComingOut #Fashion #Streetwear #Chapter2Drip #BestAd #Courage #SafeSpaces #Identity #Freedom #FamilySupport #GayLove #BisexualLove #Equality #reelitfeelit #ReelWithPurpose #ReelOfTheDay #explorepage #foryourpage #trendingreel #indianyouth #fypppppppppppppppppppppppppppppppppppppppppppppppppppppppppppppppppppppp","12","240","Video","4041","2025-10-05T15:29:59.000Z",,,,,,,,
"There are songs that echo softly. And then there are songs like 'Darya Ki Kasam' - that roar through time.

Written by Kamla Bhasin and sung by generations of women, this anthem emerged from a moment when voices from across South Asia gathered in Lahore in 1995, declaring that women’s freedom could no longer be contained - not by borders, not by faith, not by patriarchy.

The song pierces through the imposed veil - literally and metaphorically - asking: “Ye parda kaisa parda hai? Kya ye mazhab ka hissa hai?” It questions how religion and culture are often twisted into tools of control, and how systems built by men decide what women should wear, how they should walk, when they should speak.

Thirty years later, this bold feminist anthem still feels like a mirror. The imposition may change its language - from dress codes to online policing - but the struggle remains the same. Every time this song is sung, it revives a collective promise: to rise, to resist, and to rebuild a world where women define their own faith, their own freedom, their own voice.

Have you heard this anthem of women’s movement before?

[music, singers, singerinsta, musician, protest poetry, poem, protest song, anthem, hindi song, desi music, independent artists, underground music, activism, revolutionary art, voice of change, youth anthem, street performance, political art, poetic resistance, artivism]

#Music #Singers #Singerlnsta #Musician #ProtestPoetry #ProtestSong #HindiSong #Anthem #RevolutionaryArt #PoeticResistance #ActivistVoices #Artivism #DesiMusic #IndependentArtist #kamlabhasin #StreetPerformance #VoiceOfChange #YouthAnthem #IndianMusician #SocialChange #ArtForJustice #reelitfeelit #ReelWithPurpose #ReelOfTheDay #foryourpage #feministsong #explorepage #fypppppppppppppppppppppppppppppppppppppppppppppppppppppppppppppppppppppp","88","8860","Video","53950","2025-10-06T15:33:43.000Z",,,,,,,,
"""Students do not deserve to be humiliated, they have to be respected just like adults, even if they do something wrong they have to be taught what’s right but not with the cost of their mental health, their well being, not using violence but by compassion and love,"" Aashi writes on Youth Ki Awaaz.

[teacher bullying, school bullying, emotional abuse, physical punishment, body shaming, mental health, student rights, education reform, toxic discipline, school violence, classroom abuse, teacher behaviour, positive discipline, child protection, student wellbeing, compassion in education, safe schools, respect students, school culture, teacher training, corporal punishment, Indian schools, student voice, youth activism, child abuse awareness, teacher accountability, counselling in schools, student support, school mental health, student trauma, teacher misconduct, child safety, school reform, stop bullying, education system, emotional wellbeing, school counsellors, student empowerment, discipline vs abuse, child dignity]

#TeacherBullying #StopBullying #StudentVoices #EndAbuseInSchools #SchoolMentalHealth #RespectStudents #SafeSchools #EducationReform #PositiveDiscipline #ChildProtection #StopCorporalPunishment #StudentRights #YouthForChange #ClassroomAbuse #EducationSystem #StudentWellbeing #NoMoreAbuse #RaiseYourVoice #EndBodyShaming #MentalHealthMatters #TeacherAccountability #ChildSafety #EmpowerStudents #CompassionInEducation #ListenToStudents #worldteachersday #fyp #explorepage #ｆｏｒｙｏｕｒｐａｇｅ","5","107","Sidecar",,"2025-10-05T12:30:24.000Z","https://scontent-iad3-1.cdninstagram.com/v/t51.2885-15/559355018_18531479125043990_6530878260923964795_n.webp?stp=dst-jpg_e35_p1080x1080_sh0.08_tt6&_nc_ht=scontent-iad3-1.cdninstagram.com&_nc_cat=102&_nc_oc=Q6cZ2QF8igVxomgIsn1GLiwiYH3WwImf5q-oZhKmh5ebiR7PwG5qg-yNhAxENa671pVyH-c&_nc_ohc=mPnJfPY2RrIQ7kNvwF7dEAi&_nc_gid=7eKTheoGy0Xed4aeT4dNsw&edm=APs17CUBAAAA&ccb=7-5&oh=00_Afcf_PSrAHGxy8Yk2Uqnnm18_8XJjz7nxG5BjTgLCt3hew&oe=68EDC6A6&_nc_sid=10d13b","https://scontent-iad3-1.cdninstagram.com/v/t51.2885-15/559231146_18531479134043990_6789247255183028286_n.webp?stp=dst-jpg_e35_p1080x1080_sh0.08_tt6&_nc_ht=scontent-iad3-1.cdninstagram.com&_nc_cat=102&_nc_oc=Q6cZ2QF8igVxomgIsn1GLiwiYH3WwImf5q-oZhKmh5ebiR7PwG5qg-yNhAxENa671pVyH-c&_nc_ohc=Bo5Oqk6YmNcQ7kNvwHwUb9H&_nc_gid=7eKTheoGy0Xed4aeT4dNsw&edm=APs17CUBAAAA&ccb=7-5&oh=00_Afe9P7Vs1RhLk4W_3765_Envt5RVhSaoetipVCyI_qQoCg&oe=68EDA6C7&_nc_sid=10d13b","https://scontent-iad3-1.cdninstagram.com/v/t51.2885-15/559213053_18531479152043990_5720810610493175769_n.webp?stp=dst-jpg_e35_p1080x1080_sh0.08_tt6&_nc_ht=scontent-iad3-1.cdninstagram.com&_nc_cat=102&_nc_oc=Q6cZ2QF8igVxomgIsn1GLiwiYH3WwImf5q-oZhKmh5ebiR7PwG5qg-yNhAxENa671pVyH-c&_nc_ohc=KxGgDnqDw5wQ7kNvwEi23gC&_nc_gid=7eKTheoGy0Xed4aeT4dNsw&edm=APs17CUBAAAA&ccb=7-5&oh=00_AfecWR0JRWr3n-0VDBrg5l-wuPS8R2oYUN4HmeebT5ZsNQ&oe=68EDD092&_nc_sid=10d13b","https://scontent-iad3-1.cdninstagram.com/v/t51.2885-15/559016753_18531479149043990_6092122725476623009_n.webp?stp=dst-jpg_e35_p1080x1080_sh0.08_tt6&_nc_ht=scontent-iad3-1.cdninstagram.com&_nc_cat=102&_nc_oc=Q6cZ2QF8igVxomgIsn1GLiwiYH3WwImf5q-oZhKmh5ebiR7PwG5qg-yNhAxENa671pVyH-c&_nc_ohc=xOp9dAdt0iAQ7kNvwFdYk2a&_nc_gid=7eKTheoGy0Xed4aeT4dNsw&edm=APs17CUBAAAA&ccb=7-5&oh=00_AfcxKZsC9zFLMXEPcdLef34IbzruA3Jn1F_dC8ADxokd5A&oe=68EDC74C&_nc_sid=10d13b","https://scontent-iad3-1.cdninstagram.com/v/t51.2885-15/558860131_18531479164043990_5407879797727854668_n.webp?stp=dst-jpg_e35_p1080x1080_sh0.08_tt6&_nc_ht=scontent-iad3-1.cdninstagram.com&_nc_cat=102&_nc_oc=Q6cZ2QF8igVxomgIsn1GLiwiYH3WwImf5q-oZhKmh5ebiR7PwG5qg-yNhAxENa671pVyH-c&_nc_ohc=wMUmGJYuI3UQ7kNvwFQ0PpF&_nc_gid=7eKTheoGy0Xed4aeT4dNsw&edm=APs17CUBAAAA&ccb=7-5&oh=00_Affw6t59ZELZqmRybzAN7mUcIjp0L9sRDp5KOzx-KDPDTQ&oe=68EDBA51&_nc_sid=10d13b",,,
